{
  "contract_version": "atlas.projection-delivery.v1",
  "delivery_id": "projection-atlas-board-000-unavailable-unknown-zero-attempt",
  "adapter": "discordos",
  "card_id": "ATLAS-BOARD-000",
  "project_id": "atlas",
  "board_id": "atlas-control",
  "event_id": "event-atlas-board-000-1",
  "event_sequence": 1,
  "card_version": 1,
  "idempotency_key": "projection:ATLAS-BOARD-000:1:discordos",
  "payload_digest": "sha256:4444444444444444444444444444444444444444444444444444444444444444",
  "availability": "unavailable",
  "state": "UNKNOWN",
  "retry": {"attempt_count": 0, "retryable": true, "next_attempt_at": "2026-07-17T12:05:00Z"},
  "touched_card_readback": {
    "mode": "exact-touched-card",
    "card_id": "ATLAS-BOARD-000",
    "state": "UNKNOWN",
    "request_count": null,
    "full_scan": false,
    "observed_at": null,
    "response_digest": null
  },
  "last_error": {"code": "ADAPTER_UNAVAILABLE"},
  "enqueued_at": "2026-07-17T12:00:00Z",
  "projection_gates_engineering": false
}
